{
    "$schema": "https://json-schema.org/draft/2020-12/schema",
    "$id": "https://etapsky.github.io/sdf/schemas/purchase-order/v0.1.json",
    "title": "SDF Purchase Order",
    "description": "Schema for SDF purchase order documents. Version: 0.1.",
    "type": "object",
    "required": ["document_type", "po_number", "issue_date", "buyer", "supplier", "line_items", "totals"],
    "properties": {
      "document_type":  { "type": "string", "const": "purchase_order" },
      "po_number":      { "type": "string", "minLength": 1 },
      "issue_date":     { "type": "string", "format": "date" },
      "delivery_date":  { "type": "string", "format": "date" },
      "payment_terms":  { "type": "string" },
      "buyer":          { "$ref": "#/$defs/party" },
      "supplier":       { "$ref": "#/$defs/party" },
      "line_items": {
        "type": "array",
        "minItems": 1,
        "items": { "$ref": "#/$defs/line_item" }
      },
      "totals":   { "$ref": "#/$defs/totals" },
      "delivery": { "$ref": "#/$defs/delivery" }
    },
    "additionalProperties": false,
    "$defs": {
      "monetary_amount": {
        "type": "object",
        "required": ["amount", "currency"],
        "properties": {
          "amount":   { "type": "string", "pattern": "^\\d+(\\.\\d{1,4})?$" },
          "currency": { "type": "string", "pattern": "^[A-Z]{3}$" }
        },
        "additionalProperties": false
      },
      "address": {
        "type": "object",
        "required": ["street", "city", "country"],
        "properties": {
          "street":      { "type": "string" },
          "city":        { "type": "string" },
          "postal_code": { "type": "string" },
          "country":     { "type": "string", "pattern": "^[A-Z]{2}$" }
        },
        "additionalProperties": false
      },
      "contact": {
        "type": "object",
        "properties": {
          "name":  { "type": "string" },
          "email": { "type": "string", "format": "email" },
          "phone": { "type": "string" }
        },
        "additionalProperties": false
      },
      "party": {
        "type": "object",
        "required": ["name"],
        "properties": {
          "name":    { "type": "string" },
          "id":      { "type": "string" },
          "address": { "$ref": "#/$defs/address" },
          "contact": { "$ref": "#/$defs/contact" }
        },
        "additionalProperties": false
      },
      "line_item": {
        "type": "object",
        "required": ["line_number", "description", "quantity", "unit_price", "subtotal"],
        "properties": {
          "line_number": { "type": "integer", "minimum": 1 },
          "sku":         { "type": "string" },
          "description": { "type": "string" },
          "quantity":    { "type": "number", "minimum": 0 },
          "unit":        { "type": "string" },
          "unit_price":  { "$ref": "#/$defs/monetary_amount" },
          "subtotal":    { "$ref": "#/$defs/monetary_amount" }
        },
        "additionalProperties": false
      },
      "totals": {
        "type": "object",
        "required": ["gross"],
        "properties": {
          "net":   { "$ref": "#/$defs/monetary_amount" },
          "vat":   { "$ref": "#/$defs/monetary_amount" },
          "gross": { "$ref": "#/$defs/monetary_amount" }
        },
        "additionalProperties": false
      },
      "delivery": {
        "type": "object",
        "properties": {
          "address":      { "$ref": "#/$defs/address" },
          "terms":        { "type": "string" },
          "instructions": { "type": "string" }
        },
        "additionalProperties": false
      }
    }
  }