{
    "document_type": "purchase_order",
    "po_number": "PO-2026-00388",
    "issue_date": "2026-03-01",
    "delivery_date": "2026-03-28",
    "payment_terms": "Net 30",
    "buyer": {
      "name": "Global Logistics AG",
      "id": "CH-123.456.789",
      "address": {
        "street": "Bahnhofstrasse 4",
        "city": "Zürich",
        "postal_code": "8001",
        "country": "CH"
      },
      "contact": {
        "name": "Thomas Meier",
        "email": "t.meier@global-logistics.ch",
        "phone": "+41 44 000 0000"
      }
    },
    "supplier": {
      "name": "Acme Supplies GmbH",
      "id": "DE123456789",
      "address": {
        "street": "Hauptstraße 12",
        "city": "Berlin",
        "postal_code": "10115",
        "country": "DE"
      }
    },
    "line_items": [
      {
        "line_number": 1,
        "sku": "VALVE-TYPE-A",
        "description": "Industrial valve Type-A",
        "quantity": 50,
        "unit": "pcs",
        "unit_price": { "amount": "24.00", "currency": "EUR" },
        "subtotal": { "amount": "1200.00", "currency": "EUR" }
      },
      {
        "line_number": 2,
        "sku": "GASKET-A-SET",
        "description": "Gasket set Type-A compatible",
        "quantity": 50,
        "unit": "pcs",
        "unit_price": { "amount": "4.80", "currency": "EUR" },
        "subtotal": { "amount": "240.00", "currency": "EUR" }
      }
    ],
    "totals": {
      "net":   { "amount": "1440.00", "currency": "EUR" },
      "vat":   { "amount": "273.60", "currency": "EUR" },
      "gross": { "amount": "1713.60", "currency": "EUR" }
    },
    "delivery": {
      "address": {
        "street": "Werkstrasse 9",
        "city": "Basel",
        "postal_code": "4052",
        "country": "CH"
      },
      "terms": "DDP Basel",
      "instructions": "Deliver to warehouse entrance, attention: receiving dept."
    }
  }